{
  "schema_version": "1.0",
  "event_name": "checkout.request",
  "timestamp": "2026-02-17T10:00:00Z",
  "user": {"id": "u123", "tier": "free", "region": "us", "vip": false},
  "request": {"trace_id": "aaaaaaaaaaaaaaaaaaaaaaaaaaaaaaa1", "span_id": "bbbbbbbbbbbbbb01", "flow": "checkout", "feature_flags": []},
  "system": {"service": "checkout", "env": "prod", "version": "1.0.0", "deployment_id": "deploy_001"},
  "outcome": {"success": true, "status_code": 200, "kind": "http"},
  "metrics": {"latency_ms": 45}
}
